<?xml version="1.0"?>
<product xmlns:xsi="http://www.w3.org/2001/XMLSchema-instance" xsi:noNamespaceSchemaLocation="Ekart.xsd">
    <electronicdevices>
        <name>Clock</name>
        <price>500</price>
    </electronicdevices>
    <clothes>
        <mencloth>
            <name>T-Shirts</name>
            <price>599</price>
        </mencloth>
        <kids>
            <name>Jeans</name>
            <price>999</price>
        </kids>
    </clothes>
</product>